Código,Nome,Início,Término,Região,País,Setor,Sub-setor,Instituição executora,
BRA/04/044-A130,Missão de Negociação de Projetos de Capacitação Técnica na área da Saúde com o Senegal,5/18/2007,7/18/2007,África,Senegal,Cooperação Técnica,Missão de Prospecção/Multidisciplinar,MS,
BRA/04/044-A137,Apoio ao Projeto de intercâmbio em agricultura familiar da Federação dos Trabalhadores na Agricultura Familiar da Região Sul (FETRAF) e do Conselho de Concertação e de Cooperação Rural do Senegal,6/25/2007,7/25/2007,África,Senegal,Agricultura,Agricultura Familiar,ABC,
BRA/04/044-A170,Missão de Prospecção técnica na área de triagem neonatal,10/20/2007,11/10/2007,África,Senegal,Cooperação Técnica,Missão de Prospecção/Multidisciplinar,MS - Aisa,
BRA/04/044-A171,CAPACITAÇÃO TÉCNICA DE PROFISSIONAIS SENEGALESES EM ATENÇÃO BÁSICA E AUTO CUIDADO,10/20/2007,11/10/2007,África,Senegal,Saúde ,Controle e Prevenção de Doenças,MS - Aisa,
BRA/98/004-A057,Missão técnica para conhecer o Programa brasileiro de Aquicultura e Pesca,8/12/2008,10/12/2008,África,Senegal,Pesca,Piscicultura,SEAP-PR,
BRA/04/043-S070,Apoio ao Desenvolvimento da Horticultura no Senegal,11/20/2008,12/31/2009,África,Senegal,Agricultura,Horticultura,EMBRAPA; EMATER-DF;SEAPA-DF,Ajuste Complementar - 17/9/2008
BRA/04/043-A332,"Missão técnica para elaboração e apresentação do projeto ""Apoio ao Desenvolvimento da Rizicultura no Senegal""",8/5/2009,11/5/2009,África,Senegal,Agricultura,Cultivos Anuais,EMBRAPA,
BRA/04/044-A371,"Missão Técnica para Apresentação e Assinatura do Projeto ""Apoio ao Desenvolvimento da Rizicultura no Senegal",2/9/2010,5/9/2010,África,Senegal,Agricultura,Pesquisa,EMBRAPA,
BRA/04/044-S181,Capacitação Técnica em Sistemas de Produção de Pecuária de Corte e de Leite no Senegal,2/26/2010,8/26/2010,África,Senegal,Pecuária,Pesquisa,EMBRAPA,Ajuste Complementar - 17/09/2008
BRA/04/044-A386,Missão Multidisciplinar à República do Sudão para Detalhamento de Projetos de Cooperação Técnica,2/24/2010,8/24/2010,África,Sudão,Saúde ,Controle e Prevenção de Doenças,EMBRAPA; FIOCRUZ-RJ; GOV-BA; MDA; OBFC,
BRA/04/044-A666,Apoio ao Referendo de Secessão do Sul do Sudão,12/8/2010,3/8/2011,África,Sudão,Legislativo,Políticas Públicas,CNJ,
BRA/04/043-A225,Missão multidisciplinar para detalhamento de projetos de cooperação técnica entre o Brasil e a Tanzãnia,4/2/2009,6/30/2009,África,Tanzânia,Agricultura,Fruticultura,EMBRAPA; PNDST/AIDS,
BRA/04/044-S176,Aprimorando as Tecnologias Pós-Colheita da Castanha de caju na Tanzânia,1/19/2010,11/19/2012,África,Tanzânia,Agricultura,Fruticultura,EMBRAPA,Ajuste Complementar - 01/07/2009
BRA/04/044-A595,Missão para a Prospecção de Projetos de Cooperação em Agricultura e Biocombustíveis,9/1/2010,6/1/2011,África,Tanzânia,Minas e Energia,Biocombustíveis,,
BRA/04/044-A283,Missão ao Togo para Elaboração de Projeto de Cooperação Técnica na área de Combate a Exploração de Crianças e Adolescentes,10/7/2009,4/7/2010,África,Togo,Segurança Pública,Prevenção do Crime,SDH-PR,
BRA/04/044-A026,Apoio ao desenvolvimento da produção de Eucalipto na Tunísia,2/10/2006,4/10/2006,África,Tunísia,Agricultura,Políticas Públicas,EMBRAPA,
BRA/98/004-A052,Missão de Prospecção de Cooperação Técnica na Àrea de Saúde.(HIV/AIDS),11/10/2005,12/10/2005,África,Zâmbia,Cooperação Técnica,Missão de Prospecção/Multidisciplinar,CRHF - Centro de Referência Hélio Fraga; MS-FIOCRUZ,
BRA/04/044-A167,Missão de detalhamento de projeto de cooperação técnica na área de saúde (HIV/AIDS),10/15/2007,12/15/2007,África,Zâmbia,Saúde ,DST/AIDS,,
BRA/04/043-A275,Intercâmbio de experiência na área de doenças animais,5/27/2009,7/22/2009,África,Zâmbia,Pecuária,Defesa Sanitária Animal,EMBRAPA,
BRA/04/044-A390,Missão multidisciplinar para detalhamento de projetos de cooperação técnica entre o Brasil e a Zâmbia,2/25/2010,5/25/2010,África,Zâmbia,Saúde ,Controle e Prevenção de Doenças,MS/SVS; SENAI,
BRA/04/044-A499,Missão de Prospecção de Projetos de Cooperação Técnica entre o Brasil e a Zâmbia na Área de Biocombustíveis e Doenças Animais,5/31/2010,10/30/2010,África,Zâmbia,Minas e Energia,Biocombustíveis,,
BRA/98/004-A053,Missão de Prospecção de Cooperação Técnica na Àrea de Saúde.(HIV/AIDS),11/10/2005,12/10/2005,África,Zimbabue,Cooperação Técnica,Missão de Prospecção/Multidisciplinar,,
BRA/04/044-A448,Missão ao Brasil para intercâmbi de conhecimentos em Agricultura Familiar,4/1/2010,7/1/2010,África,Zimbabue,Agricultura,Agricultura Familiar,MDA (Brasil),
BRA/04/044-A590,"Visitas de estudo ao Brasil para intercâmbio de conhecimentos em reforma agrária, em agricultura familiar e em sistema de manejo de grãos",9/1/2010,12/1/2010,África,Zimbabue,Agricultura,Agricultura Familiar,MDA (Brasil),